{
  "contract_version": "1.0.0",
  "tool": {
    "name": "@irgendutils/post-deploy-smoke-test",
    "version": "1.0.0"
  },
  "status": "success",
  "summary": {
    "total": 6,
    "passed": 6,
    "failed": 0,
    "warnings": 0
  },
  "results": [
    {
      "path": "/",
      "url": "https://acme.example.com/",
      "authed": false,
      "ok": true,
      "status": 200,
      "duration_ms": 142,
      "failures": [],
      "warnings": []
    },
    {
      "path": "/shop",
      "url": "https://acme.example.com/shop",
      "authed": false,
      "ok": true,
      "status": 200,
      "duration_ms": 260,
      "failures": [],
      "warnings": []
    },
    {
      "path": "/wp-json",
      "url": "https://acme.example.com/wp-json",
      "authed": false,
      "ok": true,
      "status": 200,
      "duration_ms": 95,
      "failures": [],
      "warnings": []
    },
    {
      "path": "/old-page",
      "url": "https://acme.example.com/old-page",
      "authed": false,
      "ok": true,
      "status": 301,
      "duration_ms": 40,
      "failures": [],
      "warnings": []
    },
    {
      "path": "/wp-login.php",
      "url": "https://acme.example.com/wp-login.php",
      "authed": false,
      "ok": true,
      "status": 200,
      "duration_ms": 110,
      "failures": [],
      "warnings": []
    },
    {
      "path": "/wp-json/wp/v2/users/me",
      "url": "https://acme.example.com/wp-json/wp/v2/users/me",
      "authed": true,
      "ok": true,
      "status": 200,
      "duration_ms": 130,
      "failures": [],
      "warnings": []
    }
  ],
  "warnings": [],
  "errors": [],
  "timing": {
    "start_time": "2026-07-31T03:45:50.835Z",
    "end_time": "2026-07-31T03:45:50.837Z",
    "duration_ms": 2
  },
  "artifacts": []
}
